t 0 /NodeList/1/$ns3::Ipv4L3Protocol/Tx(1) ns3::Ipv4Header (tos 0x0 DSCP Default ECN Not-ECT ttl 64 id 0 protocol 6 offset (bytes) 0 flags [none] length: 56 10.0.1.1 > 10.0.2.2) ns3::TcpHeader (49153 > 50000 [SYN] Seq=0 Ack=0 Win=65535 ns3::TcpOptionTS(0;0) ns3::TcpOptionWinScale(6) ns3::TcpOptionEnd(EOL))
r 0.0450464 /NodeList/0/$ns3::Ipv4L3Protocol/Rx(1) ns3::Ipv4Header (tos 0x0 DSCP Default ECN Not-ECT ttl 64 id 0 protocol 6 offset (bytes) 0 flags [none] length: 56 10.0.1.1 > 10.0.2.2) ns3::TcpHeader (49153 > 50000 [SYN] Seq=0 Ack=0 Win=65535 ns3::TcpOptionTS(0;0) ns3::TcpOptionWinScale(6) ns3::TcpOptionEnd(EOL))
t 0.0450464 /NodeList/0/$ns3::Ipv4L3Protocol/Tx(2) ns3::Ipv4Header (tos 0x0 DSCP Default ECN Not-ECT ttl 63 id 0 protocol 6 offset (bytes) 0 flags [none] length: 56 10.0.1.1 > 10.0.2.2) ns3::TcpHeader (49153 > 50000 [SYN] Seq=0 Ack=0 Win=65535 ns3::TcpOptionTS(0;0) ns3::TcpOptionWinScale(6) ns3::TcpOptionEnd(EOL))
r 0.0452884 /NodeList/2/$ns3::Ipv4L3Protocol/Rx(1) ns3::Ipv4Header (tos 0x0 DSCP Default ECN Not-ECT ttl 63 id 0 protocol 6 offset (bytes) 0 flags [none] length: 56 10.0.1.1 > 10.0.2.2) ns3::TcpHeader (49153 > 50000 [SYN] Seq=0 Ack=0 Win=65535 ns3::TcpOptionTS(0;0) ns3::TcpOptionWinScale(6) ns3::TcpOptionEnd(EOL))
t 0.0452884 /NodeList/2/$ns3::Ipv4L3Protocol/Tx(1) ns3::Ipv4Header (tos 0x0 DSCP Default ECN Not-ECT ttl 64 id 0 protocol 6 offset (bytes) 0 flags [none] length: 56 10.0.2.2 > 10.0.1.1) ns3::TcpHeader (50000 > 49153 [SYN|ACK] Seq=0 Ack=1 Win=65535 ns3::TcpOptionTS(45;0) ns3::TcpOptionWinScale(6) ns3::TcpOptionEnd(EOL))
r 0.0455304 /NodeList/0/$ns3::Ipv4L3Protocol/Rx(2) ns3::Ipv4Header (tos 0x0 DSCP Default ECN Not-ECT ttl 64 id 0 protocol 6 offset (bytes) 0 flags [none] length: 56 10.0.2.2 > 10.0.1.1) ns3::TcpHeader (50000 > 49153 [SYN|ACK] Seq=0 Ack=1 Win=65535 ns3::TcpOptionTS(45;0) ns3::TcpOptionWinScale(6) ns3::TcpOptionEnd(EOL))
t 0.0455304 /NodeList/0/$ns3::Ipv4L3Protocol/Tx(1) ns3::Ipv4Header (tos 0x0 DSCP Default ECN Not-ECT ttl 63 id 0 protocol 6 offset (bytes) 0 flags [none] length: 56 10.0.2.2 > 10.0.1.1) ns3::TcpHeader (50000 > 49153 [SYN|ACK] Seq=0 Ack=1 Win=65535 ns3::TcpOptionTS(45;0) ns3::TcpOptionWinScale(6) ns3::TcpOptionEnd(EOL))
r 0.0905768 /NodeList/1/$ns3::Ipv4L3Protocol/Rx(1) ns3::Ipv4Header (tos 0x0 DSCP Default ECN Not-ECT ttl 63 id 0 protocol 6 offset (bytes) 0 flags [none] length: 56 10.0.2.2 > 10.0.1.1) ns3::TcpHeader (50000 > 49153 [SYN|ACK] Seq=0 Ack=1 Win=65535 ns3::TcpOptionTS(45;0) ns3::TcpOptionWinScale(6) ns3::TcpOptionEnd(EOL))
t 0.0905768 /NodeList/1/$ns3::Ipv4L3Protocol/Tx(1) ns3::Ipv4Header (tos 0x0 DSCP Default ECN Not-ECT ttl 64 id 1 protocol 6 offset (bytes) 0 flags [none] length: 52 10.0.1.1 > 10.0.2.2) ns3::TcpHeader (49153 > 50000 [ACK] Seq=1 Ack=1 Win=32768 ns3::TcpOptionTS(90;45) ns3::TcpOptionEnd(EOL))
t 0.0905768 /NodeList/1/$ns3::Ipv4L3Protocol/Tx(1) ns3::Ipv4Header (tos 0x0 DSCP Default ECN Not-ECT ttl 64 id 2 protocol 6 offset (bytes) 0 flags [none] length: 392 10.0.1.1 > 10.0.2.2) ns3::TcpHeader (49153 > 50000 [ACK] Seq=1 Ack=1 Win=32768 ns3::TcpOptionTS(90;45) ns3::TcpOptionEnd(EOL)) Payload (size=340)
r 0.13562 /NodeList/0/$ns3::Ipv4L3Protocol/Rx(1) ns3::Ipv4Header (tos 0x0 DSCP Default ECN Not-ECT ttl 64 id 1 protocol 6 offset (bytes) 0 flags [none] length: 52 10.0.1.1 > 10.0.2.2) ns3::TcpHeader (49153 > 50000 [ACK] Seq=1 Ack=1 Win=32768 ns3::TcpOptionTS(90;45) ns3::TcpOptionEnd(EOL))
t 0.13562 /NodeList/0/$ns3::Ipv4L3Protocol/Tx(2) ns3::Ipv4Header (tos 0x0 DSCP Default ECN Not-ECT ttl 63 id 1 protocol 6 offset (bytes) 0 flags [none] length: 52 10.0.1.1 > 10.0.2.2) ns3::TcpHeader (49153 > 50000 [ACK] Seq=1 Ack=1 Win=32768 ns3::TcpOptionTS(90;45) ns3::TcpOptionEnd(EOL))
r 0.135846 /NodeList/2/$ns3::Ipv4L3Protocol/Rx(1) ns3::Ipv4Header (tos 0x0 DSCP Default ECN Not-ECT ttl 63 id 1 protocol 6 offset (bytes) 0 flags [none] length: 52 10.0.1.1 > 10.0.2.2) ns3::TcpHeader (49153 > 50000 [ACK] Seq=1 Ack=1 Win=32768 ns3::TcpOptionTS(90;45) ns3::TcpOptionEnd(EOL))
r 0.135935 /NodeList/0/$ns3::Ipv4L3Protocol/Rx(1) ns3::Ipv4Header (tos 0x0 DSCP Default ECN Not-ECT ttl 64 id 2 protocol 6 offset (bytes) 0 flags [none] length: 392 10.0.1.1 > 10.0.2.2) ns3::TcpHeader (49153 > 50000 [ACK] Seq=1 Ack=1 Win=32768 ns3::TcpOptionTS(90;45) ns3::TcpOptionEnd(EOL)) Payload (size=340)
t 0.135935 /NodeList/0/$ns3::Ipv4L3Protocol/Tx(2) ns3::Ipv4Header (tos 0x0 DSCP Default ECN Not-ECT ttl 63 id 2 protocol 6 offset (bytes) 0 flags [none] length: 392 10.0.1.1 > 10.0.2.2) ns3::TcpHeader (49153 > 50000 [ACK] Seq=1 Ack=1 Win=32768 ns3::TcpOptionTS(90;45) ns3::TcpOptionEnd(EOL)) Payload (size=340)
r 0.137521 /NodeList/2/$ns3::Ipv4L3Protocol/Rx(1) ns3::Ipv4Header (tos 0x0 DSCP Default ECN Not-ECT ttl 63 id 2 protocol 6 offset (bytes) 0 flags [none] length: 392 10.0.1.1 > 10.0.2.2) ns3::TcpHeader (49153 > 50000 [ACK] Seq=1 Ack=1 Win=32768 ns3::TcpOptionTS(90;45) ns3::TcpOptionEnd(EOL)) Payload (size=340)
t 0.137521 /NodeList/2/$ns3::Ipv4L3Protocol/Tx(1) ns3::Ipv4Header (tos 0x0 DSCP Default ECN Not-ECT ttl 64 id 1 protocol 6 offset (bytes) 0 flags [none] length: 52 10.0.2.2 > 10.0.1.1) ns3::TcpHeader (50000 > 49153 [ACK] Seq=1 Ack=341 Win=32768 ns3::TcpOptionTS(137;90) ns3::TcpOptionEnd(EOL))
r 0.137747 /NodeList/0/$ns3::Ipv4L3Protocol/Rx(2) ns3::Ipv4Header (tos 0x0 DSCP Default ECN Not-ECT ttl 64 id 1 protocol 6 offset (bytes) 0 flags [none] length: 52 10.0.2.2 > 10.0.1.1) ns3::TcpHeader (50000 > 49153 [ACK] Seq=1 Ack=341 Win=32768 ns3::TcpOptionTS(137;90) ns3::TcpOptionEnd(EOL))
t 0.137747 /NodeList/0/$ns3::Ipv4L3Protocol/Tx(1) ns3::Ipv4Header (tos 0x0 DSCP Default ECN Not-ECT ttl 63 id 1 protocol 6 offset (bytes) 0 flags [none] length: 52 10.0.2.2 > 10.0.1.1) ns3::TcpHeader (50000 > 49153 [ACK] Seq=1 Ack=341 Win=32768 ns3::TcpOptionTS(137;90) ns3::TcpOptionEnd(EOL))
r 0.18279 /NodeList/1/$ns3::Ipv4L3Protocol/Rx(1) ns3::Ipv4Header (tos 0x0 DSCP Default ECN Not-ECT ttl 63 id 1 protocol 6 offset (bytes) 0 flags [none] length: 52 10.0.2.2 > 10.0.1.1) ns3::TcpHeader (50000 > 49153 [ACK] Seq=1 Ack=341 Win=32768 ns3::TcpOptionTS(137;90) ns3::TcpOptionEnd(EOL))
t 0.18279 /NodeList/1/$ns3::Ipv4L3Protocol/Tx(1) ns3::Ipv4Header (tos 0x0 DSCP Default ECN Not-ECT ttl 64 id 3 protocol 6 offset (bytes) 0 flags [none] length: 392 10.0.1.1 > 10.0.2.2) ns3::TcpHeader (49153 > 50000 [ACK] Seq=341 Ack=1 Win=32768 ns3::TcpOptionTS(182;137) ns3::TcpOptionEnd(EOL)) Payload (size=340)
t 0.18279 /NodeList/1/$ns3::Ipv4L3Protocol/Tx(1) ns3::Ipv4Header (tos 0x0 DSCP Default ECN Not-ECT ttl 64 id 4 protocol 6 offset (bytes) 0 flags [none] length: 392 10.0.1.1 > 10.0.2.2) ns3::TcpHeader (49153 > 50000 [ACK] Seq=681 Ack=1 Win=32768 ns3::TcpOptionTS(182;137) ns3::TcpOptionEnd(EOL)) Payload (size=340)
r 0.228106 /NodeList/0/$ns3::Ipv4L3Protocol/Rx(1) ns3::Ipv4Header (tos 0x0 DSCP Default ECN Not-ECT ttl 64 id 3 protocol 6 offset (bytes) 0 flags [none] length: 392 10.0.1.1 > 10.0.2.2) ns3::TcpHeader (49153 > 50000 [ACK] Seq=341 Ack=1 Win=32768 ns3::TcpOptionTS(182;137) ns3::TcpOptionEnd(EOL)) Payload (size=340)
t 0.228106 /NodeList/0/$ns3::Ipv4L3Protocol/Tx(2) ns3::Ipv4Header (tos 0x0 DSCP Default ECN Not-ECT ttl 63 id 3 protocol 6 offset (bytes) 0 flags [none] length: 392 10.0.1.1 > 10.0.2.2) ns3::TcpHeader (49153 > 50000 [ACK] Seq=341 Ack=1 Win=32768 ns3::TcpOptionTS(182;137) ns3::TcpOptionEnd(EOL)) Payload (size=340)
r 0.228421 /NodeList/0/$ns3::Ipv4L3Protocol/Rx(1) ns3::Ipv4Header (tos 0x0 DSCP Default ECN Not-ECT ttl 64 id 4 protocol 6 offset (bytes) 0 flags [none] length: 392 10.0.1.1 > 10.0.2.2) ns3::TcpHeader (49153 > 50000 [ACK] Seq=681 Ack=1 Win=32768 ns3::TcpOptionTS(182;137) ns3::TcpOptionEnd(EOL)) Payload (size=340)
t 0.228421 /NodeList/0/$ns3::Ipv4L3Protocol/Tx(2) ns3::Ipv4Header (tos 0x0 DSCP Default ECN Not-ECT ttl 63 id 4 protocol 6 offset (bytes) 0 flags [none] length: 392 10.0.1.1 > 10.0.2.2) ns3::TcpHeader (49153 > 50000 [ACK] Seq=681 Ack=1 Win=32768 ns3::TcpOptionTS(182;137) ns3::TcpOptionEnd(EOL)) Payload (size=340)
r 0.229692 /NodeList/2/$ns3::Ipv4L3Protocol/Rx(1) ns3::Ipv4Header (tos 0x0 DSCP Default ECN Not-ECT ttl 63 id 3 protocol 6 offset (bytes) 0 flags [none] length: 392 10.0.1.1 > 10.0.2.2) ns3::TcpHeader (49153 > 50000 [ACK] Seq=341 Ack=1 Win=32768 ns3::TcpOptionTS(182;137) ns3::TcpOptionEnd(EOL)) Payload (size=340)
r 0.231268 /NodeList/2/$ns3::Ipv4L3Protocol/Rx(1) ns3::Ipv4Header (tos 0x0 DSCP Default ECN Not-ECT ttl 63 id 4 protocol 6 offset (bytes) 0 flags [none] length: 392 10.0.1.1 > 10.0.2.2) ns3::TcpHeader (49153 > 50000 [ACK] Seq=681 Ack=1 Win=32768 ns3::TcpOptionTS(182;137) ns3::TcpOptionEnd(EOL)) Payload (size=340)
t 0.231268 /NodeList/2/$ns3::Ipv4L3Protocol/Tx(1) ns3::Ipv4Header (tos 0x0 DSCP Default ECN Not-ECT ttl 64 id 2 protocol 6 offset (bytes) 0 flags [none] length: 52 10.0.2.2 > 10.0.1.1) ns3::TcpHeader (50000 > 49153 [ACK] Seq=1 Ack=1021 Win=32768 ns3::TcpOptionTS(231;182) ns3::TcpOptionEnd(EOL))
r 0.231494 /NodeList/0/$ns3::Ipv4L3Protocol/Rx(2) ns3::Ipv4Header (tos 0x0 DSCP Default ECN Not-ECT ttl 64 id 2 protocol 6 offset (bytes) 0 flags [none] length: 52 10.0.2.2 > 10.0.1.1) ns3::TcpHeader (50000 > 49153 [ACK] Seq=1 Ack=1021 Win=32768 ns3::TcpOptionTS(231;182) ns3::TcpOptionEnd(EOL))
t 0.231494 /NodeList/0/$ns3::Ipv4L3Protocol/Tx(1) ns3::Ipv4Header (tos 0x0 DSCP Default ECN Not-ECT ttl 63 id 2 protocol 6 offset (bytes) 0 flags [none] length: 52 10.0.2.2 > 10.0.1.1) ns3::TcpHeader (50000 > 49153 [ACK] Seq=1 Ack=1021 Win=32768 ns3::TcpOptionTS(231;182) ns3::TcpOptionEnd(EOL))
r 0.276537 /NodeList/1/$ns3::Ipv4L3Protocol/Rx(1) ns3::Ipv4Header (tos 0x0 DSCP Default ECN Not-ECT ttl 63 id 2 protocol 6 offset (bytes) 0 flags [none] length: 52 10.0.2.2 > 10.0.1.1) ns3::TcpHeader (50000 > 49153 [ACK] Seq=1 Ack=1021 Win=32768 ns3::TcpOptionTS(231;182) ns3::TcpOptionEnd(EOL))
t 0.276537 /NodeList/1/$ns3::Ipv4L3Protocol/Tx(1) ns3::Ipv4Header (tos 0x0 DSCP Default ECN Not-ECT ttl 64 id 5 protocol 6 offset (bytes) 0 flags [none] length: 392 10.0.1.1 > 10.0.2.2) ns3::TcpHeader (49153 > 50000 [ACK] Seq=1021 Ack=1 Win=32768 ns3::TcpOptionTS(276;231) ns3::TcpOptionEnd(EOL)) Payload (size=340)
t 0.276537 /NodeList/1/$ns3::Ipv4L3Protocol/Tx(1) ns3::Ipv4Header (tos 0x0 DSCP Default ECN Not-ECT ttl 64 id 6 protocol 6 offset (bytes) 0 flags [none] length: 392 10.0.1.1 > 10.0.2.2) ns3::TcpHeader (49153 > 50000 [ACK] Seq=1361 Ack=1 Win=32768 ns3::TcpOptionTS(276;231) ns3::TcpOptionEnd(EOL)) Payload (size=340)
t 0.276537 /NodeList/1/$ns3::Ipv4L3Protocol/Tx(1) ns3::Ipv4Header (tos 0x0 DSCP Default ECN Not-ECT ttl 64 id 7 protocol 6 offset (bytes) 0 flags [none] length: 392 10.0.1.1 > 10.0.2.2) ns3::TcpHeader (49153 > 50000 [ACK] Seq=1701 Ack=1 Win=32768 ns3::TcpOptionTS(276;231) ns3::TcpOptionEnd(EOL)) Payload (size=340)
r 0.321852 /NodeList/0/$ns3::Ipv4L3Protocol/Rx(1) ns3::Ipv4Header (tos 0x0 DSCP Default ECN Not-ECT ttl 64 id 5 protocol 6 offset (bytes) 0 flags [none] length: 392 10.0.1.1 > 10.0.2.2) ns3::TcpHeader (49153 > 50000 [ACK] Seq=1021 Ack=1 Win=32768 ns3::TcpOptionTS(276;231) ns3::TcpOptionEnd(EOL)) Payload (size=340)
t 0.321852 /NodeList/0/$ns3::Ipv4L3Protocol/Tx(2) ns3::Ipv4Header (tos 0x0 DSCP Default ECN Not-ECT ttl 63 id 5 protocol 6 offset (bytes) 0 flags [none] length: 392 10.0.1.1 > 10.0.2.2) ns3::TcpHeader (49153 > 50000 [ACK] Seq=1021 Ack=1 Win=32768 ns3::TcpOptionTS(276;231) ns3::TcpOptionEnd(EOL)) Payload (size=340)
r 0.322167 /NodeList/0/$ns3::Ipv4L3Protocol/Rx(1) ns3::Ipv4Header (tos 0x0 DSCP Default ECN Not-ECT ttl 64 id 6 protocol 6 offset (bytes) 0 flags [none] length: 392 10.0.1.1 > 10.0.2.2) ns3::TcpHeader (49153 > 50000 [ACK] Seq=1361 Ack=1 Win=32768 ns3::TcpOptionTS(276;231) ns3::TcpOptionEnd(EOL)) Payload (size=340)
t 0.322167 /NodeList/0/$ns3::Ipv4L3Protocol/Tx(2) ns3::Ipv4Header (tos 0x0 DSCP Default ECN Not-ECT ttl 63 id 6 protocol 6 offset (bytes) 0 flags [none] length: 392 10.0.1.1 > 10.0.2.2) ns3::TcpHeader (49153 > 50000 [ACK] Seq=1361 Ack=1 Win=32768 ns3::TcpOptionTS(276;231) ns3::TcpOptionEnd(EOL)) Payload (size=340)
r 0.322482 /NodeList/0/$ns3::Ipv4L3Protocol/Rx(1) ns3::Ipv4Header (tos 0x0 DSCP Default ECN Not-ECT ttl 64 id 7 protocol 6 offset (bytes) 0 flags [none] length: 392 10.0.1.1 > 10.0.2.2) ns3::TcpHeader (49153 > 50000 [ACK] Seq=1701 Ack=1 Win=32768 ns3::TcpOptionTS(276;231) ns3::TcpOptionEnd(EOL)) Payload (size=340)
t 0.322482 /NodeList/0/$ns3::Ipv4L3Protocol/Tx(2) ns3::Ipv4Header (tos 0x0 DSCP Default ECN Not-ECT ttl 63 id 7 protocol 6 offset (bytes) 0 flags [none] length: 392 10.0.1.1 > 10.0.2.2) ns3::TcpHeader (49153 > 50000 [ACK] Seq=1701 Ack=1 Win=32768 ns3::TcpOptionTS(276;231) ns3::TcpOptionEnd(EOL)) Payload (size=340)
r 0.323438 /NodeList/2/$ns3::Ipv4L3Protocol/Rx(1) ns3::Ipv4Header (tos 0x0 DSCP Default ECN Not-ECT ttl 63 id 5 protocol 6 offset (bytes) 0 flags [none] length: 392 10.0.1.1 > 10.0.2.2) ns3::TcpHeader (49153 > 50000 [ACK] Seq=1021 Ack=1 Win=32768 ns3::TcpOptionTS(276;231) ns3::TcpOptionEnd(EOL)) Payload (size=340)
r 0.325014 /NodeList/2/$ns3::Ipv4L3Protocol/Rx(1) ns3::Ipv4Header (tos 0x0 DSCP Default ECN Not-ECT ttl 63 id 6 protocol 6 offset (bytes) 0 flags [none] length: 392 10.0.1.1 > 10.0.2.2) ns3::TcpHeader (49153 > 50000 [ACK] Seq=1361 Ack=1 Win=32768 ns3::TcpOptionTS(276;231) ns3::TcpOptionEnd(EOL)) Payload (size=340)
t 0.325014 /NodeList/2/$ns3::Ipv4L3Protocol/Tx(1) ns3::Ipv4Header (tos 0x0 DSCP Default ECN Not-ECT ttl 64 id 3 protocol 6 offset (bytes) 0 flags [none] length: 52 10.0.2.2 > 10.0.1.1) ns3::TcpHeader (50000 > 49153 [ACK] Seq=1 Ack=1701 Win=32768 ns3::TcpOptionTS(325;276) ns3::TcpOptionEnd(EOL))
r 0.32524 /NodeList/0/$ns3::Ipv4L3Protocol/Rx(2) ns3::Ipv4Header (tos 0x0 DSCP Default ECN Not-ECT ttl 64 id 3 protocol 6 offset (bytes) 0 flags [none] length: 52 10.0.2.2 > 10.0.1.1) ns3::TcpHeader (50000 > 49153 [ACK] Seq=1 Ack=1701 Win=32768 ns3::TcpOptionTS(325;276) ns3::TcpOptionEnd(EOL))
t 0.32524 /NodeList/0/$ns3::Ipv4L3Protocol/Tx(1) ns3::Ipv4Header (tos 0x0 DSCP Default ECN Not-ECT ttl 63 id 3 protocol 6 offset (bytes) 0 flags [none] length: 52 10.0.2.2 > 10.0.1.1) ns3::TcpHeader (50000 > 49153 [ACK] Seq=1 Ack=1701 Win=32768 ns3::TcpOptionTS(325;276) ns3::TcpOptionEnd(EOL))
r 0.32659 /NodeList/2/$ns3::Ipv4L3Protocol/Rx(1) ns3::Ipv4Header (tos 0x0 DSCP Default ECN Not-ECT ttl 63 id 7 protocol 6 offset (bytes) 0 flags [none] length: 392 10.0.1.1 > 10.0.2.2) ns3::TcpHeader (49153 > 50000 [ACK] Seq=1701 Ack=1 Win=32768 ns3::TcpOptionTS(276;231) ns3::TcpOptionEnd(EOL)) Payload (size=340)
r 0.370283 /NodeList/1/$ns3::Ipv4L3Protocol/Rx(1) ns3::Ipv4Header (tos 0x0 DSCP Default ECN Not-ECT ttl 63 id 3 protocol 6 offset (bytes) 0 flags [none] length: 52 10.0.2.2 > 10.0.1.1) ns3::TcpHeader (50000 > 49153 [ACK] Seq=1 Ack=1701 Win=32768 ns3::TcpOptionTS(325;276) ns3::TcpOptionEnd(EOL))
t 0.370283 /NodeList/1/$ns3::Ipv4L3Protocol/Tx(1) ns3::Ipv4Header (tos 0x0 DSCP Default ECN Not-ECT ttl 64 id 8 protocol 6 offset (bytes) 0 flags [none] length: 392 10.0.1.1 > 10.0.2.2) ns3::TcpHeader (49153 > 50000 [ACK] Seq=2041 Ack=1 Win=32768 ns3::TcpOptionTS(370;325) ns3::TcpOptionEnd(EOL)) Payload (size=340)
t 0.370283 /NodeList/1/$ns3::Ipv4L3Protocol/Tx(1) ns3::Ipv4Header (tos 0x0 DSCP Default ECN Not-ECT ttl 64 id 9 protocol 6 offset (bytes) 0 flags [none] length: 392 10.0.1.1 > 10.0.2.2) ns3::TcpHeader (49153 > 50000 [ACK] Seq=2381 Ack=1 Win=32768 ns3::TcpOptionTS(370;325) ns3::TcpOptionEnd(EOL)) Payload (size=340)
t 0.370283 /NodeList/1/$ns3::Ipv4L3Protocol/Tx(1) ns3::Ipv4Header (tos 0x0 DSCP Default ECN Not-ECT ttl 64 id 10 protocol 6 offset (bytes) 0 flags [none] length: 392 10.0.1.1 > 10.0.2.2) ns3::TcpHeader (49153 > 50000 [ACK] Seq=2721 Ack=1 Win=32768 ns3::TcpOptionTS(370;325) ns3::TcpOptionEnd(EOL)) Payload (size=340)
r 0.415598 /NodeList/0/$ns3::Ipv4L3Protocol/Rx(1) ns3::Ipv4Header (tos 0x0 DSCP Default ECN Not-ECT ttl 64 id 8 protocol 6 offset (bytes) 0 flags [none] length: 392 10.0.1.1 > 10.0.2.2) ns3::TcpHeader (49153 > 50000 [ACK] Seq=2041 Ack=1 Win=32768 ns3::TcpOptionTS(370;325) ns3::TcpOptionEnd(EOL)) Payload (size=340)
t 0.415598 /NodeList/0/$ns3::Ipv4L3Protocol/Tx(2) ns3::Ipv4Header (tos 0x0 DSCP Default ECN Not-ECT ttl 63 id 8 protocol 6 offset (bytes) 0 flags [none] length: 392 10.0.1.1 > 10.0.2.2) ns3::TcpHeader (49153 > 50000 [ACK] Seq=2041 Ack=1 Win=32768 ns3::TcpOptionTS(370;325) ns3::TcpOptionEnd(EOL)) Payload (size=340)
r 0.415914 /NodeList/0/$ns3::Ipv4L3Protocol/Rx(1) ns3::Ipv4Header (tos 0x0 DSCP Default ECN Not-ECT ttl 64 id 9 protocol 6 offset (bytes) 0 flags [none] length: 392 10.0.1.1 > 10.0.2.2) ns3::TcpHeader (49153 > 50000 [ACK] Seq=2381 Ack=1 Win=32768 ns3::TcpOptionTS(370;325) ns3::TcpOptionEnd(EOL)) Payload (size=340)
t 0.415914 /NodeList/0/$ns3::Ipv4L3Protocol/Tx(2) ns3::Ipv4Header (tos 0x0 DSCP Default ECN Not-ECT ttl 63 id 9 protocol 6 offset (bytes) 0 flags [none] length: 392 10.0.1.1 > 10.0.2.2) ns3::TcpHeader (49153 > 50000 [ACK] Seq=2381 Ack=1 Win=32768 ns3::TcpOptionTS(370;325) ns3::TcpOptionEnd(EOL)) Payload (size=340)
r 0.416229 /NodeList/0/$ns3::Ipv4L3Protocol/Rx(1) ns3::Ipv4Header (tos 0x0 DSCP Default ECN Not-ECT ttl 64 id 10 protocol 6 offset (bytes) 0 flags [none] length: 392 10.0.1.1 > 10.0.2.2) ns3::TcpHeader (49153 > 50000 [ACK] Seq=2721 Ack=1 Win=32768 ns3::TcpOptionTS(370;325) ns3::TcpOptionEnd(EOL)) Payload (size=340)
t 0.416229 /NodeList/0/$ns3::Ipv4L3Protocol/Tx(2) ns3::Ipv4Header (tos 0x0 DSCP Default ECN Not-ECT ttl 63 id 10 protocol 6 offset (bytes) 0 flags [none] length: 392 10.0.1.1 > 10.0.2.2) ns3::TcpHeader (49153 > 50000 [ACK] Seq=2721 Ack=1 Win=32768 ns3::TcpOptionTS(370;325) ns3::TcpOptionEnd(EOL)) Payload (size=340)
r 0.417184 /NodeList/2/$ns3::Ipv4L3Protocol/Rx(1) ns3::Ipv4Header (tos 0x0 DSCP Default ECN Not-ECT ttl 63 id 8 protocol 6 offset (bytes) 0 flags [none] length: 392 10.0.1.1 > 10.0.2.2) ns3::TcpHeader (49153 > 50000 [ACK] Seq=2041 Ack=1 Win=32768 ns3::TcpOptionTS(370;325) ns3::TcpOptionEnd(EOL)) Payload (size=340)
t 0.417184 /NodeList/2/$ns3::Ipv4L3Protocol/Tx(1) ns3::Ipv4Header (tos 0x0 DSCP Default ECN Not-ECT ttl 64 id 4 protocol 6 offset (bytes) 0 flags [none] length: 52 10.0.2.2 > 10.0.1.1) ns3::TcpHeader (50000 > 49153 [ACK] Seq=1 Ack=2381 Win=32768 ns3::TcpOptionTS(417;276) ns3::TcpOptionEnd(EOL))
r 0.41741 /NodeList/0/$ns3::Ipv4L3Protocol/Rx(2) ns3::Ipv4Header (tos 0x0 DSCP Default ECN Not-ECT ttl 64 id 4 protocol 6 offset (bytes) 0 flags [none] length: 52 10.0.2.2 > 10.0.1.1) ns3::TcpHeader (50000 > 49153 [ACK] Seq=1 Ack=2381 Win=32768 ns3::TcpOptionTS(417;276) ns3::TcpOptionEnd(EOL))
t 0.41741 /NodeList/0/$ns3::Ipv4L3Protocol/Tx(1) ns3::Ipv4Header (tos 0x0 DSCP Default ECN Not-ECT ttl 63 id 4 protocol 6 offset (bytes) 0 flags [none] length: 52 10.0.2.2 > 10.0.1.1) ns3::TcpHeader (50000 > 49153 [ACK] Seq=1 Ack=2381 Win=32768 ns3::TcpOptionTS(417;276) ns3::TcpOptionEnd(EOL))
r 0.41876 /NodeList/2/$ns3::Ipv4L3Protocol/Rx(1) ns3::Ipv4Header (tos 0x0 DSCP Default ECN Not-ECT ttl 63 id 9 protocol 6 offset (bytes) 0 flags [none] length: 392 10.0.1.1 > 10.0.2.2) ns3::TcpHeader (49153 > 50000 [ACK] Seq=2381 Ack=1 Win=32768 ns3::TcpOptionTS(370;325) ns3::TcpOptionEnd(EOL)) Payload (size=340)
r 0.420336 /NodeList/2/$ns3::Ipv4L3Protocol/Rx(1) ns3::Ipv4Header (tos 0x0 DSCP Default ECN Not-ECT ttl 63 id 10 protocol 6 offset (bytes) 0 flags [none] length: 392 10.0.1.1 > 10.0.2.2) ns3::TcpHeader (49153 > 50000 [ACK] Seq=2721 Ack=1 Win=32768 ns3::TcpOptionTS(370;325) ns3::TcpOptionEnd(EOL)) Payload (size=340)
t 0.420336 /NodeList/2/$ns3::Ipv4L3Protocol/Tx(1) ns3::Ipv4Header (tos 0x0 DSCP Default ECN Not-ECT ttl 64 id 5 protocol 6 offset (bytes) 0 flags [none] length: 52 10.0.2.2 > 10.0.1.1) ns3::TcpHeader (50000 > 49153 [ACK] Seq=1 Ack=3061 Win=32768 ns3::TcpOptionTS(420;370) ns3::TcpOptionEnd(EOL))
r 0.420562 /NodeList/0/$ns3::Ipv4L3Protocol/Rx(2) ns3::Ipv4Header (tos 0x0 DSCP Default ECN Not-ECT ttl 64 id 5 protocol 6 offset (bytes) 0 flags [none] length: 52 10.0.2.2 > 10.0.1.1) ns3::TcpHeader (50000 > 49153 [ACK] Seq=1 Ack=3061 Win=32768 ns3::TcpOptionTS(420;370) ns3::TcpOptionEnd(EOL))
t 0.420562 /NodeList/0/$ns3::Ipv4L3Protocol/Tx(1) ns3::Ipv4Header (tos 0x0 DSCP Default ECN Not-ECT ttl 63 id 5 protocol 6 offset (bytes) 0 flags [none] length: 52 10.0.2.2 > 10.0.1.1) ns3::TcpHeader (50000 > 49153 [ACK] Seq=1 Ack=3061 Win=32768 ns3::TcpOptionTS(420;370) ns3::TcpOptionEnd(EOL))
r 0.462454 /NodeList/1/$ns3::Ipv4L3Protocol/Rx(1) ns3::Ipv4Header (tos 0x0 DSCP Default ECN Not-ECT ttl 63 id 4 protocol 6 offset (bytes) 0 flags [none] length: 52 10.0.2.2 > 10.0.1.1) ns3::TcpHeader (50000 > 49153 [ACK] Seq=1 Ack=2381 Win=32768 ns3::TcpOptionTS(417;276) ns3::TcpOptionEnd(EOL))
t 0.462454 /NodeList/1/$ns3::Ipv4L3Protocol/Tx(1) ns3::Ipv4Header (tos 0x0 DSCP Default ECN Not-ECT ttl 64 id 11 protocol 6 offset (bytes) 0 flags [none] length: 392 10.0.1.1 > 10.0.2.2) ns3::TcpHeader (49153 > 50000 [ACK] Seq=3061 Ack=1 Win=32768 ns3::TcpOptionTS(462;417) ns3::TcpOptionEnd(EOL)) Payload (size=340)
t 0.462454 /NodeList/1/$ns3::Ipv4L3Protocol/Tx(1) ns3::Ipv4Header (tos 0x0 DSCP Default ECN Not-ECT ttl 64 id 12 protocol 6 offset (bytes) 0 flags [none] length: 392 10.0.1.1 > 10.0.2.2) ns3::TcpHeader (49153 > 50000 [ACK] Seq=3401 Ack=1 Win=32768 ns3::TcpOptionTS(462;417) ns3::TcpOptionEnd(EOL)) Payload (size=340)
t 0.462454 /NodeList/1/$ns3::Ipv4L3Protocol/Tx(1) ns3::Ipv4Header (tos 0x0 DSCP Default ECN Not-ECT ttl 64 id 13 protocol 6 offset (bytes) 0 flags [none] length: 392 10.0.1.1 > 10.0.2.2) ns3::TcpHeader (49153 > 50000 [ACK] Seq=3741 Ack=1 Win=32768 ns3::TcpOptionTS(462;417) ns3::TcpOptionEnd(EOL)) Payload (size=340)
r 0.465606 /NodeList/1/$ns3::Ipv4L3Protocol/Rx(1) ns3::Ipv4Header (tos 0x0 DSCP Default ECN Not-ECT ttl 63 id 5 protocol 6 offset (bytes) 0 flags [none] length: 52 10.0.2.2 > 10.0.1.1) ns3::TcpHeader (50000 > 49153 [ACK] Seq=1 Ack=3061 Win=32768 ns3::TcpOptionTS(420;370) ns3::TcpOptionEnd(EOL))
t 0.465606 /NodeList/1/$ns3::Ipv4L3Protocol/Tx(1) ns3::Ipv4Header (tos 0x0 DSCP Default ECN Not-ECT ttl 64 id 14 protocol 6 offset (bytes) 0 flags [none] length: 392 10.0.1.1 > 10.0.2.2) ns3::TcpHeader (49153 > 50000 [ACK] Seq=4081 Ack=1 Win=32768 ns3::TcpOptionTS(465;420) ns3::TcpOptionEnd(EOL)) Payload (size=340)
t 0.465606 /NodeList/1/$ns3::Ipv4L3Protocol/Tx(1) ns3::Ipv4Header (tos 0x0 DSCP Default ECN Not-ECT ttl 64 id 15 protocol 6 offset (bytes) 0 flags [none] length: 392 10.0.1.1 > 10.0.2.2) ns3::TcpHeader (49153 > 50000 [ACK] Seq=4421 Ack=1 Win=32768 ns3::TcpOptionTS(465;420) ns3::TcpOptionEnd(EOL)) Payload (size=340)
t 0.465606 /NodeList/1/$ns3::Ipv4L3Protocol/Tx(1) ns3::Ipv4Header (tos 0x0 DSCP Default ECN Not-ECT ttl 64 id 16 protocol 6 offset (bytes) 0 flags [none] length: 392 10.0.1.1 > 10.0.2.2) ns3::TcpHeader (49153 > 50000 [ACK] Seq=4761 Ack=1 Win=32768 ns3::TcpOptionTS(465;420) ns3::TcpOptionEnd(EOL)) Payload (size=340)
r 0.507769 /NodeList/0/$ns3::Ipv4L3Protocol/Rx(1) ns3::Ipv4Header (tos 0x0 DSCP Default ECN Not-ECT ttl 64 id 11 protocol 6 offset (bytes) 0 flags [none] length: 392 10.0.1.1 > 10.0.2.2) ns3::TcpHeader (49153 > 50000 [ACK] Seq=3061 Ack=1 Win=32768 ns3::TcpOptionTS(462;417) ns3::TcpOptionEnd(EOL)) Payload (size=340)
t 0.507769 /NodeList/0/$ns3::Ipv4L3Protocol/Tx(2) ns3::Ipv4Header (tos 0x0 DSCP Default ECN Not-ECT ttl 63 id 11 protocol 6 offset (bytes) 0 flags [none] length: 392 10.0.1.1 > 10.0.2.2) ns3::TcpHeader (49153 > 50000 [ACK] Seq=3061 Ack=1 Win=32768 ns3::TcpOptionTS(462;417) ns3::TcpOptionEnd(EOL)) Payload (size=340)
r 0.508084 /NodeList/0/$ns3::Ipv4L3Protocol/Rx(1) ns3::Ipv4Header (tos 0x0 DSCP Default ECN Not-ECT ttl 64 id 12 protocol 6 offset (bytes) 0 flags [none] length: 392 10.0.1.1 > 10.0.2.2) ns3::TcpHeader (49153 > 50000 [ACK] Seq=3401 Ack=1 Win=32768 ns3::TcpOptionTS(462;417) ns3::TcpOptionEnd(EOL)) Payload (size=340)
t 0.508084 /NodeList/0/$ns3::Ipv4L3Protocol/Tx(2) ns3::Ipv4Header (tos 0x0 DSCP Default ECN Not-ECT ttl 63 id 12 protocol 6 offset (bytes) 0 flags [none] length: 392 10.0.1.1 > 10.0.2.2) ns3::TcpHeader (49153 > 50000 [ACK] Seq=3401 Ack=1 Win=32768 ns3::TcpOptionTS(462;417) ns3::TcpOptionEnd(EOL)) Payload (size=340)
r 0.508399 /NodeList/0/$ns3::Ipv4L3Protocol/Rx(1) ns3::Ipv4Header (tos 0x0 DSCP Default ECN Not-ECT ttl 64 id 13 protocol 6 offset (bytes) 0 flags [none] length: 392 10.0.1.1 > 10.0.2.2) ns3::TcpHeader (49153 > 50000 [ACK] Seq=3741 Ack=1 Win=32768 ns3::TcpOptionTS(462;417) ns3::TcpOptionEnd(EOL)) Payload (size=340)
t 0.508399 /NodeList/0/$ns3::Ipv4L3Protocol/Tx(2) ns3::Ipv4Header (tos 0x0 DSCP Default ECN Not-ECT ttl 63 id 13 protocol 6 offset (bytes) 0 flags [none] length: 392 10.0.1.1 > 10.0.2.2) ns3::TcpHeader (49153 > 50000 [ACK] Seq=3741 Ack=1 Win=32768 ns3::TcpOptionTS(462;417) ns3::TcpOptionEnd(EOL)) Payload (size=340)
r 0.509355 /NodeList/2/$ns3::Ipv4L3Protocol/Rx(1) ns3::Ipv4Header (tos 0x0 DSCP Default ECN Not-ECT ttl 63 id 11 protocol 6 offset (bytes) 0 flags [none] length: 392 10.0.1.1 > 10.0.2.2) ns3::TcpHeader (49153 > 50000 [ACK] Seq=3061 Ack=1 Win=32768 ns3::TcpOptionTS(462;417) ns3::TcpOptionEnd(EOL)) Payload (size=340)
r 0.510921 /NodeList/0/$ns3::Ipv4L3Protocol/Rx(1) ns3::Ipv4Header (tos 0x0 DSCP Default ECN Not-ECT ttl 64 id 14 protocol 6 offset (bytes) 0 flags [none] length: 392 10.0.1.1 > 10.0.2.2) ns3::TcpHeader (49153 > 50000 [ACK] Seq=4081 Ack=1 Win=32768 ns3::TcpOptionTS(465;420) ns3::TcpOptionEnd(EOL)) Payload (size=340)
t 0.510921 /NodeList/0/$ns3::Ipv4L3Protocol/Tx(2) ns3::Ipv4Header (tos 0x0 DSCP Default ECN Not-ECT ttl 63 id 14 protocol 6 offset (bytes) 0 flags [none] length: 392 10.0.1.1 > 10.0.2.2) ns3::TcpHeader (49153 > 50000 [ACK] Seq=4081 Ack=1 Win=32768 ns3::TcpOptionTS(465;420) ns3::TcpOptionEnd(EOL)) Payload (size=340)
r 0.510931 /NodeList/2/$ns3::Ipv4L3Protocol/Rx(1) ns3::Ipv4Header (tos 0x0 DSCP Default ECN Not-ECT ttl 63 id 12 protocol 6 offset (bytes) 0 flags [none] length: 392 10.0.1.1 > 10.0.2.2) ns3::TcpHeader (49153 > 50000 [ACK] Seq=3401 Ack=1 Win=32768 ns3::TcpOptionTS(462;417) ns3::TcpOptionEnd(EOL)) Payload (size=340)
t 0.510931 /NodeList/2/$ns3::Ipv4L3Protocol/Tx(1) ns3::Ipv4Header (tos 0x0 DSCP Default ECN Not-ECT ttl 64 id 6 protocol 6 offset (bytes) 0 flags [none] length: 52 10.0.2.2 > 10.0.1.1) ns3::TcpHeader (50000 > 49153 [ACK] Seq=1 Ack=3741 Win=32768 ns3::TcpOptionTS(510;462) ns3::TcpOptionEnd(EOL))
r 0.511157 /NodeList/0/$ns3::Ipv4L3Protocol/Rx(2) ns3::Ipv4Header (tos 0x0 DSCP Default ECN Not-ECT ttl 64 id 6 protocol 6 offset (bytes) 0 flags [none] length: 52 10.0.2.2 > 10.0.1.1) ns3::TcpHeader (50000 > 49153 [ACK] Seq=1 Ack=3741 Win=32768 ns3::TcpOptionTS(510;462) ns3::TcpOptionEnd(EOL))
t 0.511157 /NodeList/0/$ns3::Ipv4L3Protocol/Tx(1) ns3::Ipv4Header (tos 0x0 DSCP Default ECN Not-ECT ttl 63 id 6 protocol 6 offset (bytes) 0 flags [none] length: 52 10.0.2.2 > 10.0.1.1) ns3::TcpHeader (50000 > 49153 [ACK] Seq=1 Ack=3741 Win=32768 ns3::TcpOptionTS(510;462) ns3::TcpOptionEnd(EOL))
r 0.511236 /NodeList/0/$ns3::Ipv4L3Protocol/Rx(1) ns3::Ipv4Header (tos 0x0 DSCP Default ECN Not-ECT ttl 64 id 15 protocol 6 offset (bytes) 0 flags [none] length: 392 10.0.1.1 > 10.0.2.2) ns3::TcpHeader (49153 > 50000 [ACK] Seq=4421 Ack=1 Win=32768 ns3::TcpOptionTS(465;420) ns3::TcpOptionEnd(EOL)) Payload (size=340)
t 0.511236 /NodeList/0/$ns3::Ipv4L3Protocol/Tx(2) ns3::Ipv4Header (tos 0x0 DSCP Default ECN Not-ECT ttl 63 id 15 protocol 6 offset (bytes) 0 flags [none] length: 392 10.0.1.1 > 10.0.2.2) ns3::TcpHeader (49153 > 50000 [ACK] Seq=4421 Ack=1 Win=32768 ns3::TcpOptionTS(465;420) ns3::TcpOptionEnd(EOL)) Payload (size=340)
r 0.511551 /NodeList/0/$ns3::Ipv4L3Protocol/Rx(1) ns3::Ipv4Header (tos 0x0 DSCP Default ECN Not-ECT ttl 64 id 16 protocol 6 offset (bytes) 0 flags [none] length: 392 10.0.1.1 > 10.0.2.2) ns3::TcpHeader (49153 > 50000 [ACK] Seq=4761 Ack=1 Win=32768 ns3::TcpOptionTS(465;420) ns3::TcpOptionEnd(EOL)) Payload (size=340)
t 0.511551 /NodeList/0/$ns3::Ipv4L3Protocol/Tx(2) ns3::Ipv4Header (tos 0x0 DSCP Default ECN Not-ECT ttl 63 id 16 protocol 6 offset (bytes) 0 flags [none] length: 392 10.0.1.1 > 10.0.2.2) ns3::TcpHeader (49153 > 50000 [ACK] Seq=4761 Ack=1 Win=32768 ns3::TcpOptionTS(465;420) ns3::TcpOptionEnd(EOL)) Payload (size=340)
r 0.512507 /NodeList/2/$ns3::Ipv4L3Protocol/Rx(1) ns3::Ipv4Header (tos 0x0 DSCP Default ECN Not-ECT ttl 63 id 13 protocol 6 offset (bytes) 0 flags [none] length: 392 10.0.1.1 > 10.0.2.2) ns3::TcpHeader (49153 > 50000 [ACK] Seq=3741 Ack=1 Win=32768 ns3::TcpOptionTS(462;417) ns3::TcpOptionEnd(EOL)) Payload (size=340)
r 0.514083 /NodeList/2/$ns3::Ipv4L3Protocol/Rx(1) ns3::Ipv4Header (tos 0x0 DSCP Default ECN Not-ECT ttl 63 id 14 protocol 6 offset (bytes) 0 flags [none] length: 392 10.0.1.1 > 10.0.2.2) ns3::TcpHeader (49153 > 50000 [ACK] Seq=4081 Ack=1 Win=32768 ns3::TcpOptionTS(465;420) ns3::TcpOptionEnd(EOL)) Payload (size=340)
t 0.514083 /NodeList/2/$ns3::Ipv4L3Protocol/Tx(1) ns3::Ipv4Header (tos 0x0 DSCP Default ECN Not-ECT ttl 64 id 7 protocol 6 offset (bytes) 0 flags [none] length: 52 10.0.2.2 > 10.0.1.1) ns3::TcpHeader (50000 > 49153 [ACK] Seq=1 Ack=4421 Win=32768 ns3::TcpOptionTS(514;462) ns3::TcpOptionEnd(EOL))
r 0.514309 /NodeList/0/$ns3::Ipv4L3Protocol/Rx(2) ns3::Ipv4Header (tos 0x0 DSCP Default ECN Not-ECT ttl 64 id 7 protocol 6 offset (bytes) 0 flags [none] length: 52 10.0.2.2 > 10.0.1.1) ns3::TcpHeader (50000 > 49153 [ACK] Seq=1 Ack=4421 Win=32768 ns3::TcpOptionTS(514;462) ns3::TcpOptionEnd(EOL))
t 0.514309 /NodeList/0/$ns3::Ipv4L3Protocol/Tx(1) ns3::Ipv4Header (tos 0x0 DSCP Default ECN Not-ECT ttl 63 id 7 protocol 6 offset (bytes) 0 flags [none] length: 52 10.0.2.2 > 10.0.1.1) ns3::TcpHeader (50000 > 49153 [ACK] Seq=1 Ack=4421 Win=32768 ns3::TcpOptionTS(514;462) ns3::TcpOptionEnd(EOL))
r 0.515659 /NodeList/2/$ns3::Ipv4L3Protocol/Rx(1) ns3::Ipv4Header (tos 0x0 DSCP Default ECN Not-ECT ttl 63 id 15 protocol 6 offset (bytes) 0 flags [none] length: 392 10.0.1.1 > 10.0.2.2) ns3::TcpHeader (49153 > 50000 [ACK] Seq=4421 Ack=1 Win=32768 ns3::TcpOptionTS(465;420) ns3::TcpOptionEnd(EOL)) Payload (size=340)
r 0.517235 /NodeList/2/$ns3::Ipv4L3Protocol/Rx(1) ns3::Ipv4Header (tos 0x0 DSCP Default ECN Not-ECT ttl 63 id 16 protocol 6 offset (bytes) 0 flags [none] length: 392 10.0.1.1 > 10.0.2.2) ns3::TcpHeader (49153 > 50000 [ACK] Seq=4761 Ack=1 Win=32768 ns3::TcpOptionTS(465;420) ns3::TcpOptionEnd(EOL)) Payload (size=340)
t 0.517235 /NodeList/2/$ns3::Ipv4L3Protocol/Tx(1) ns3::Ipv4Header (tos 0x0 DSCP Default ECN Not-ECT ttl 64 id 8 protocol 6 offset (bytes) 0 flags [none] length: 52 10.0.2.2 > 10.0.1.1) ns3::TcpHeader (50000 > 49153 [ACK] Seq=1 Ack=5101 Win=32768 ns3::TcpOptionTS(517;465) ns3::TcpOptionEnd(EOL))
r 0.517461 /NodeList/0/$ns3::Ipv4L3Protocol/Rx(2) ns3::Ipv4Header (tos 0x0 DSCP Default ECN Not-ECT ttl 64 id 8 protocol 6 offset (bytes) 0 flags [none] length: 52 10.0.2.2 > 10.0.1.1) ns3::TcpHeader (50000 > 49153 [ACK] Seq=1 Ack=5101 Win=32768 ns3::TcpOptionTS(517;465) ns3::TcpOptionEnd(EOL))
t 0.517461 /NodeList/0/$ns3::Ipv4L3Protocol/Tx(1) ns3::Ipv4Header (tos 0x0 DSCP Default ECN Not-ECT ttl 63 id 8 protocol 6 offset (bytes) 0 flags [none] length: 52 10.0.2.2 > 10.0.1.1) ns3::TcpHeader (50000 > 49153 [ACK] Seq=1 Ack=5101 Win=32768 ns3::TcpOptionTS(517;465) ns3::TcpOptionEnd(EOL))
r 0.5562 /NodeList/1/$ns3::Ipv4L3Protocol/Rx(1) ns3::Ipv4Header (tos 0x0 DSCP Default ECN Not-ECT ttl 63 id 6 protocol 6 offset (bytes) 0 flags [none] length: 52 10.0.2.2 > 10.0.1.1) ns3::TcpHeader (50000 > 49153 [ACK] Seq=1 Ack=3741 Win=32768 ns3::TcpOptionTS(510;462) ns3::TcpOptionEnd(EOL))
t 0.5562 /NodeList/1/$ns3::Ipv4L3Protocol/Tx(1) ns3::Ipv4Header (tos 0x0 DSCP Default ECN Not-ECT ttl 64 id 17 protocol 6 offset (bytes) 0 flags [none] length: 392 10.0.1.1 > 10.0.2.2) ns3::TcpHeader (49153 > 50000 [ACK] Seq=5101 Ack=1 Win=32768 ns3::TcpOptionTS(556;510) ns3::TcpOptionEnd(EOL)) Payload (size=340)
t 0.5562 /NodeList/1/$ns3::Ipv4L3Protocol/Tx(1) ns3::Ipv4Header (tos 0x0 DSCP Default ECN Not-ECT ttl 64 id 18 protocol 6 offset (bytes) 0 flags [none] length: 392 10.0.1.1 > 10.0.2.2) ns3::TcpHeader (49153 > 50000 [ACK] Seq=5441 Ack=1 Win=32768 ns3::TcpOptionTS(556;510) ns3::TcpOptionEnd(EOL)) Payload (size=340)
t 0.5562 /NodeList/1/$ns3::Ipv4L3Protocol/Tx(1) ns3::Ipv4Header (tos 0x0 DSCP Default ECN Not-ECT ttl 64 id 19 protocol 6 offset (bytes) 0 flags [none] length: 392 10.0.1.1 > 10.0.2.2) ns3::TcpHeader (49153 > 50000 [ACK] Seq=5781 Ack=1 Win=32768 ns3::TcpOptionTS(556;510) ns3::TcpOptionEnd(EOL)) Payload (size=340)
r 0.559352 /NodeList/1/$ns3::Ipv4L3Protocol/Rx(1) ns3::Ipv4Header (tos 0x0 DSCP Default ECN Not-ECT ttl 63 id 7 protocol 6 offset (bytes) 0 flags [none] length: 52 10.0.2.2 > 10.0.1.1) ns3::TcpHeader (50000 > 49153 [ACK] Seq=1 Ack=4421 Win=32768 ns3::TcpOptionTS(514;462) ns3::TcpOptionEnd(EOL))
t 0.559352 /NodeList/1/$ns3::Ipv4L3Protocol/Tx(1) ns3::Ipv4Header (tos 0x0 DSCP Default ECN Not-ECT ttl 64 id 20 protocol 6 offset (bytes) 0 flags [none] length: 392 10.0.1.1 > 10.0.2.2) ns3::TcpHeader (49153 > 50000 [ACK] Seq=6121 Ack=1 Win=32768 ns3::TcpOptionTS(559;514) ns3::TcpOptionEnd(EOL)) Payload (size=340)
t 0.559352 /NodeList/1/$ns3::Ipv4L3Protocol/Tx(1) ns3::Ipv4Header (tos 0x0 DSCP Default ECN Not-ECT ttl 64 id 21 protocol 6 offset (bytes) 0 flags [none] length: 392 10.0.1.1 > 10.0.2.2) ns3::TcpHeader (49153 > 50000 [ACK] Seq=6461 Ack=1 Win=32768 ns3::TcpOptionTS(559;514) ns3::TcpOptionEnd(EOL)) Payload (size=340)
t 0.559352 /NodeList/1/$ns3::Ipv4L3Protocol/Tx(1) ns3::Ipv4Header (tos 0x0 DSCP Default ECN Not-ECT ttl 64 id 22 protocol 6 offset (bytes) 0 flags [none] length: 392 10.0.1.1 > 10.0.2.2) ns3::TcpHeader (49153 > 50000 [ACK] Seq=6801 Ack=1 Win=32768 ns3::TcpOptionTS(559;514) ns3::TcpOptionEnd(EOL)) Payload (size=340)
r 0.562504 /NodeList/1/$ns3::Ipv4L3Protocol/Rx(1) ns3::Ipv4Header (tos 0x0 DSCP Default ECN Not-ECT ttl 63 id 8 protocol 6 offset (bytes) 0 flags [none] length: 52 10.0.2.2 > 10.0.1.1) ns3::TcpHeader (50000 > 49153 [ACK] Seq=1 Ack=5101 Win=32768 ns3::TcpOptionTS(517;465) ns3::TcpOptionEnd(EOL))
t 0.562504 /NodeList/1/$ns3::Ipv4L3Protocol/Tx(1) ns3::Ipv4Header (tos 0x0 DSCP Default ECN Not-ECT ttl 64 id 23 protocol 6 offset (bytes) 0 flags [none] length: 392 10.0.1.1 > 10.0.2.2) ns3::TcpHeader (49153 > 50000 [ACK] Seq=7141 Ack=1 Win=32768 ns3::TcpOptionTS(562;517) ns3::TcpOptionEnd(EOL)) Payload (size=340)
t 0.562504 /NodeList/1/$ns3::Ipv4L3Protocol/Tx(1) ns3::Ipv4Header (tos 0x0 DSCP Default ECN Not-ECT ttl 64 id 24 protocol 6 offset (bytes) 0 flags [none] length: 392 10.0.1.1 > 10.0.2.2) ns3::TcpHeader (49153 > 50000 [ACK] Seq=7481 Ack=1 Win=32768 ns3::TcpOptionTS(562;517) ns3::TcpOptionEnd(EOL)) Payload (size=340)
t 0.562504 /NodeList/1/$ns3::Ipv4L3Protocol/Tx(1) ns3::Ipv4Header (tos 0x0 DSCP Default ECN Not-ECT ttl 64 id 25 protocol 6 offset (bytes) 0 flags [none] length: 392 10.0.1.1 > 10.0.2.2) ns3::TcpHeader (49153 > 50000 [ACK] Seq=7821 Ack=1 Win=32768 ns3::TcpOptionTS(562;517) ns3::TcpOptionEnd(EOL)) Payload (size=340)
r 0.601515 /NodeList/0/$ns3::Ipv4L3Protocol/Rx(1) ns3::Ipv4Header (tos 0x0 DSCP Default ECN Not-ECT ttl 64 id 17 protocol 6 offset (bytes) 0 flags [none] length: 392 10.0.1.1 > 10.0.2.2) ns3::TcpHeader (49153 > 50000 [ACK] Seq=5101 Ack=1 Win=32768 ns3::TcpOptionTS(556;510) ns3::TcpOptionEnd(EOL)) Payload (size=340)
t 0.601515 /NodeList/0/$ns3::Ipv4L3Protocol/Tx(2) ns3::Ipv4Header (tos 0x0 DSCP Default ECN Not-ECT ttl 63 id 17 protocol 6 offset (bytes) 0 flags [none] length: 392 10.0.1.1 > 10.0.2.2) ns3::TcpHeader (49153 > 50000 [ACK] Seq=5101 Ack=1 Win=32768 ns3::TcpOptionTS(556;510) ns3::TcpOptionEnd(EOL)) Payload (size=340)
r 0.60183 /NodeList/0/$ns3::Ipv4L3Protocol/Rx(1) ns3::Ipv4Header (tos 0x0 DSCP Default ECN Not-ECT ttl 64 id 18 protocol 6 offset (bytes) 0 flags [none] length: 392 10.0.1.1 > 10.0.2.2) ns3::TcpHeader (49153 > 50000 [ACK] Seq=5441 Ack=1 Win=32768 ns3::TcpOptionTS(556;510) ns3::TcpOptionEnd(EOL)) Payload (size=340)
t 0.60183 /NodeList/0/$ns3::Ipv4L3Protocol/Tx(2) ns3::Ipv4Header (tos 0x0 DSCP Default ECN Not-ECT ttl 63 id 18 protocol 6 offset (bytes) 0 flags [none] length: 392 10.0.1.1 > 10.0.2.2) ns3::TcpHeader (49153 > 50000 [ACK] Seq=5441 Ack=1 Win=32768 ns3::TcpOptionTS(556;510) ns3::TcpOptionEnd(EOL)) Payload (size=340)
r 0.602146 /NodeList/0/$ns3::Ipv4L3Protocol/Rx(1) ns3::Ipv4Header (tos 0x0 DSCP Default ECN Not-ECT ttl 64 id 19 protocol 6 offset (bytes) 0 flags [none] length: 392 10.0.1.1 > 10.0.2.2) ns3::TcpHeader (49153 > 50000 [ACK] Seq=5781 Ack=1 Win=32768 ns3::TcpOptionTS(556;510) ns3::TcpOptionEnd(EOL)) Payload (size=340)
t 0.602146 /NodeList/0/$ns3::Ipv4L3Protocol/Tx(2) ns3::Ipv4Header (tos 0x0 DSCP Default ECN Not-ECT ttl 63 id 19 protocol 6 offset (bytes) 0 flags [none] length: 392 10.0.1.1 > 10.0.2.2) ns3::TcpHeader (49153 > 50000 [ACK] Seq=5781 Ack=1 Win=32768 ns3::TcpOptionTS(556;510) ns3::TcpOptionEnd(EOL)) Payload (size=340)
r 0.603101 /NodeList/2/$ns3::Ipv4L3Protocol/Rx(1) ns3::Ipv4Header (tos 0x0 DSCP Default ECN Not-ECT ttl 63 id 17 protocol 6 offset (bytes) 0 flags [none] length: 392 10.0.1.1 > 10.0.2.2) ns3::TcpHeader (49153 > 50000 [ACK] Seq=5101 Ack=1 Win=32768 ns3::TcpOptionTS(556;510) ns3::TcpOptionEnd(EOL)) Payload (size=340)
r 0.604667 /NodeList/0/$ns3::Ipv4L3Protocol/Rx(1) ns3::Ipv4Header (tos 0x0 DSCP Default ECN Not-ECT ttl 64 id 20 protocol 6 offset (bytes) 0 flags [none] length: 392 10.0.1.1 > 10.0.2.2) ns3::TcpHeader (49153 > 50000 [ACK] Seq=6121 Ack=1 Win=32768 ns3::TcpOptionTS(559;514) ns3::TcpOptionEnd(EOL)) Payload (size=340)
t 0.604667 /NodeList/0/$ns3::Ipv4L3Protocol/Tx(2) ns3::Ipv4Header (tos 0x0 DSCP Default ECN Not-ECT ttl 63 id 20 protocol 6 offset (bytes) 0 flags [none] length: 392 10.0.1.1 > 10.0.2.2) ns3::TcpHeader (49153 > 50000 [ACK] Seq=6121 Ack=1 Win=32768 ns3::TcpOptionTS(559;514) ns3::TcpOptionEnd(EOL)) Payload (size=340)
r 0.604677 /NodeList/2/$ns3::Ipv4L3Protocol/Rx(1) ns3::Ipv4Header (tos 0x0 DSCP Default ECN Not-ECT ttl 63 id 18 protocol 6 offset (bytes) 0 flags [none] length: 392 10.0.1.1 > 10.0.2.2) ns3::TcpHeader (49153 > 50000 [ACK] Seq=5441 Ack=1 Win=32768 ns3::TcpOptionTS(556;510) ns3::TcpOptionEnd(EOL)) Payload (size=340)
t 0.604677 /NodeList/2/$ns3::Ipv4L3Protocol/Tx(1) ns3::Ipv4Header (tos 0x0 DSCP Default ECN Not-ECT ttl 64 id 9 protocol 6 offset (bytes) 0 flags [none] length: 52 10.0.2.2 > 10.0.1.1) ns3::TcpHeader (50000 > 49153 [ACK] Seq=1 Ack=5781 Win=32768 ns3::TcpOptionTS(604;556) ns3::TcpOptionEnd(EOL))
r 0.604903 /NodeList/0/$ns3::Ipv4L3Protocol/Rx(2) ns3::Ipv4Header (tos 0x0 DSCP Default ECN Not-ECT ttl 64 id 9 protocol 6 offset (bytes) 0 flags [none] length: 52 10.0.2.2 > 10.0.1.1) ns3::TcpHeader (50000 > 49153 [ACK] Seq=1 Ack=5781 Win=32768 ns3::TcpOptionTS(604;556) ns3::TcpOptionEnd(EOL))
t 0.604903 /NodeList/0/$ns3::Ipv4L3Protocol/Tx(1) ns3::Ipv4Header (tos 0x0 DSCP Default ECN Not-ECT ttl 63 id 9 protocol 6 offset (bytes) 0 flags [none] length: 52 10.0.2.2 > 10.0.1.1) ns3::TcpHeader (50000 > 49153 [ACK] Seq=1 Ack=5781 Win=32768 ns3::TcpOptionTS(604;556) ns3::TcpOptionEnd(EOL))
r 0.604982 /NodeList/0/$ns3::Ipv4L3Protocol/Rx(1) ns3::Ipv4Header (tos 0x0 DSCP Default ECN Not-ECT ttl 64 id 21 protocol 6 offset (bytes) 0 flags [none] length: 392 10.0.1.1 > 10.0.2.2) ns3::TcpHeader (49153 > 50000 [ACK] Seq=6461 Ack=1 Win=32768 ns3::TcpOptionTS(559;514) ns3::TcpOptionEnd(EOL)) Payload (size=340)
t 0.604982 /NodeList/0/$ns3::Ipv4L3Protocol/Tx(2) ns3::Ipv4Header (tos 0x0 DSCP Default ECN Not-ECT ttl 63 id 21 protocol 6 offset (bytes) 0 flags [none] length: 392 10.0.1.1 > 10.0.2.2) ns3::TcpHeader (49153 > 50000 [ACK] Seq=6461 Ack=1 Win=32768 ns3::TcpOptionTS(559;514) ns3::TcpOptionEnd(EOL)) Payload (size=340)
r 0.605298 /NodeList/0/$ns3::Ipv4L3Protocol/Rx(1) ns3::Ipv4Header (tos 0x0 DSCP Default ECN Not-ECT ttl 64 id 22 protocol 6 offset (bytes) 0 flags [none] length: 392 10.0.1.1 > 10.0.2.2) ns3::TcpHeader (49153 > 50000 [ACK] Seq=6801 Ack=1 Win=32768 ns3::TcpOptionTS(559;514) ns3::TcpOptionEnd(EOL)) Payload (size=340)
